[
  {
    "term": "chop",
    "language": "pcm",
    "meaning": "to eat / food",
    "register": "informal",
    "category": "food",
    "example_sentence": "I don chop",
    "region": [
      "nationwide"
    ],
    "needs_native_review": false
  },
  {
    "term": "chop life",
    "language": "pcm",
    "meaning": "enjoy life / live well",
    "register": "slang",
    "category": "social",
    "example_sentence": "Make we chop life",
    "region": [
      "nationwide"
    ],
    "needs_native_review": false
  },
  {
    "term": "buka",
    "language": "pcm",
    "meaning": "local restaurant / canteen",
    "register": "informal",
    "category": "food",
    "example_sentence": "Make we go buka",
    "region": [
      "nationwide"
    ],
    "needs_native_review": false
  },
  {
    "term": "mama put",
    "language": "pcm",
    "meaning": "street food vendor (female)",
    "register": "informal",
    "category": "food",
    "example_sentence": "Mama put dey sell rice",
    "region": [
      "southwest",
      "southsouth"
    ],
    "needs_native_review": false
  },
  {
    "term": "abeg",
    "language": "pcm",
    "meaning": "please",
    "register": "informal",
    "category": "greeting",
    "example_sentence": "Abeg help me",
    "region": [
      "nationwide"
    ],
    "needs_native_review": false
  },
  {
    "term": "omo",
    "language": "pcm",
    "meaning": "wow / man / guy (expression)",
    "register": "slang",
    "category": "slang",
    "example_sentence": "Omo! This food sweet",
    "region": [
      "southwest"
    ],
    "needs_native_review": false
  },
  {
    "term": "ehn",
    "language": "pcm",
    "meaning": "right? / isn't it? / really?",
    "register": "informal",
    "category": "slang",
    "example_sentence": "The pepper soup hot ehn",
    "region": [
      "nationwide"
    ],
    "needs_native_review": false
  },
  {
    "term": "dey",
    "language": "pcm",
    "meaning": "is / are / be (copula)",
    "register": "informal",
    "category": "slang",
    "example_sentence": "Food dey sweet",
    "region": [
      "nationwide"
    ],
    "needs_native_review": false
  },
  {
    "term": "don",
    "language": "pcm",
    "meaning": "has / have (perfect aspect)",
    "register": "informal",
    "category": "slang",
    "example_sentence": "I don chop",
    "region": [
      "nationwide"
    ],
    "needs_native_review": false
  },
  {
    "term": "go",
    "language": "pcm",
    "meaning": "will / going to (future)",
    "register": "informal",
    "category": "slang",
    "example_sentence": "I go chop later",
    "region": [
      "nationwide"
    ],
    "needs_native_review": false
  },
  {
    "term": "wetin",
    "language": "pcm",
    "meaning": "what",
    "register": "informal",
    "category": "slang",
    "example_sentence": "Wetin you want chop?",
    "region": [
      "nationwide"
    ],
    "needs_native_review": false
  },
  {
    "term": "wey",
    "language": "pcm",
    "meaning": "which / that / who (relative)",
    "register": "informal",
    "category": "slang",
    "example_sentence": "The buka wey I dey talk",
    "region": [
      "nationwide"
    ],
    "needs_native_review": false
  },
  {
    "term": "sabi",
    "language": "pcm",
    "meaning": "to know / understand / be skilled",
    "register": "informal",
    "category": "slang",
    "example_sentence": "You sabi cook?",
    "region": [
      "nationwide"
    ],
    "needs_native_review": false
  },
  {
    "term": "fit",
    "language": "pcm",
    "meaning": "can / able to",
    "register": "informal",
    "category": "slang",
    "example_sentence": "I fit chop am",
    "region": [
      "nationwide"
    ],
    "needs_native_review": false
  },
  {
    "term": "no fit",
    "language": "pcm",
    "meaning": "cannot / unable to",
    "register": "informal",
    "category": "slang",
    "example_sentence": "I no fit chop pounded yam",
    "region": [
      "nationwide"
    ],
    "needs_native_review": false
  },
  {
    "term": "wahala",
    "language": "pcm",
    "meaning": "trouble / problem / stress",
    "register": "informal",
    "category": "slang",
    "example_sentence": "This traffic na wahala",
    "region": [
      "nationwide"
    ],
    "needs_native_review": false
  },
  {
    "term": "sharp sharp",
    "language": "pcm",
    "meaning": "quickly / immediately",
    "register": "slang",
    "category": "quantity",
    "example_sentence": "Make we go sharp sharp",
    "region": [
      "nationwide"
    ],
    "needs_native_review": false
  },
  {
    "term": "small small",
    "language": "pcm",
    "meaning": "gradually / bit by bit",
    "register": "informal",
    "category": "quantity",
    "example_sentence": "Chop am small small",
    "region": [
      "nationwide"
    ],
    "needs_native_review": false
  },
  {
    "term": "well well",
    "language": "pcm",
    "meaning": "properly / thoroughly",
    "register": "informal",
    "category": "slang",
    "example_sentence": "Wash the meat well well",
    "region": [
      "nationwide"
    ],
    "needs_native_review": false
  },
  {
    "term": "die",
    "language": "pcm",
    "meaning": "very / extremely (intensifier)",
    "register": "slang",
    "category": "slang",
    "example_sentence": "The pepper soup sweet die",
    "region": [
      "nationwide"
    ],
    "needs_native_review": false
  },
  {
    "term": "scatter",
    "language": "pcm",
    "meaning": "destroy / ruin / mess up",
    "register": "slang",
    "category": "slang",
    "example_sentence": "No scatter my food",
    "region": [
      "nationwide"
    ],
    "needs_native_review": false
  },
  {
    "term": "pepper don red",
    "language": "pcm",
    "meaning": "pepper is hot / situation is intense",
    "register": "slang",
    "category": "spice",
    "example_sentence": "Bros, pepper don red",
    "region": [
      "southwest",
      "southsouth"
    ],
    "needs_native_review": false
  },
  {
    "term": "yaji",
    "language": "pcm",
    "meaning": "suya spice blend",
    "register": "informal",
    "category": "food",
    "example_sentence": "Put plenty yaji for the suya",
    "region": [
      "northwest",
      "northeast",
      "northcentral"
    ],
    "needs_native_review": false
  },
  {
    "term": "suya",
    "language": "pcm",
    "meaning": "spiced grilled meat",
    "register": "informal",
    "category": "food",
    "example_sentence": "Suya don ready",
    "region": [
      "nationwide"
    ],
    "needs_native_review": false
  },
  {
    "term": "kilishi",
    "language": "pcm",
    "meaning": "spiced dried beef",
    "register": "informal",
    "category": "food",
    "example_sentence": "Kilishi sweet with groundnut",
    "region": [
      "northwest",
      "northeast"
    ],
    "needs_native_review": false
  },
  {
    "term": "massa",
    "language": "pcm",
    "meaning": "rice cake (Masa)",
    "register": "informal",
    "category": "food",
    "example_sentence": "Massa and miyan kuka",
    "region": [
      "northwest",
      "northeast"
    ],
    "needs_native_review": false
  },
  {
    "term": "fura",
    "language": "pcm",
    "meaning": "millet balls",
    "register": "informal",
    "category": "food",
    "example_sentence": "Fura da nono",
    "region": [
      "northwest",
      "northeast"
    ],
    "needs_native_review": false
  },
  {
    "term": "nono",
    "language": "pcm",
    "meaning": "fermented milk",
    "register": "informal",
    "category": "food",
    "example_sentence": "Fura da nono cold well well",
    "region": [
      "northwest",
      "northeast"
    ],
    "needs_native_review": false
  },
  {
    "term": "kunu",
    "language": "pcm",
    "meaning": "millet/sorghum drink",
    "register": "informal",
    "category": "drink",
    "example_sentence": "Kunu zaki sweet well well",
    "region": [
      "northwest",
      "northeast"
    ],
    "needs_native_review": false
  },
  {
    "term": "zobo",
    "language": "pcm",
    "meaning": "hibiscus drink",
    "register": "informal",
    "category": "drink",
    "example_sentence": "Zobo dey sweet for afternoon",
    "region": [
      "nationwide"
    ],
    "needs_native_review": false
  },
  {
    "term": "chapman",
    "language": "pcm",
    "meaning": "Nigerian cocktail",
    "register": "informal",
    "category": "drink",
    "example_sentence": "Make we order Chapman",
    "region": [
      "nationwide"
    ],
    "needs_native_review": false
  },
  {
    "term": "palm wine",
    "language": "pcm",
    "meaning": "fermented palm sap",
    "register": "informal",
    "category": "drink",
    "example_sentence": "Palm wine sweet pass beer",
    "region": [
      "southwest",
      "southeast",
      "southsouth"
    ],
    "needs_native_review": false
  },
  {
    "term": "emу",
    "language": "yo",
    "meaning": "palm wine",
    "register": "informal",
    "category": "drink",
    "example_sentence": "Emu ti o dun",
    "region": [
      "southwest"
    ],
    "needs_native_review": true
  },
  {
    "term": "nkwu",
    "language": "ig",
    "meaning": "palm wine",
    "register": "informal",
    "category": "drink",
    "example_sentence": "Nkwu di mma",
    "region": [
      "southeast",
      "southsouth"
    ],
    "needs_native_review": true
  },
  {
    "term": "mmanya nkwu",
    "language": "ig",
    "meaning": "palm wine (full term)",
    "register": "formal",
    "category": "drink",
    "example_sentence": "Mmanya nkwu bu mma",
    "region": [
      "southeast"
    ],
    "needs_native_review": true
  },
  {
    "term": "amala",
    "language": "yo",
    "meaning": "yam flour swallow",
    "register": "formal",
    "category": "food",
    "example_sentence": "Amala ati ewedu jeun ti o dun",
    "region": [
      "southwest"
    ],
    "needs_native_review": true
  },
  {
    "term": "ewedu",
    "language": "yo",
    "meaning": "jute leaf soup",
    "register": "formal",
    "category": "food",